coreproject,pmid,applid,title,journal,year,doi,pmc,grants,authors,citation
R01NS105691,38951525,11055066,Low-intensity pulsed ultrasound stimulation (LIPUS) modulates microglial activation following intracortical microelectrode implantation.,Nat Commun,2024,10.1038/s41467-024-49709-9,11217463,[],"['Li F', 'Gallego J', 'Tirko NN', 'Greaser J', 'Bashe D', 'Patel R', 'Shaker E', 'Van Valkenburg GE', 'Alsubhi AS', 'Wellman S', 'Singh V', 'Padilla CG', 'Gheres KW', 'Broussard JI', 'Bagwell R', 'Mulvihill M', 'Kozai TDY']","Li F, et al. Low-intensity pulsed ultrasound stimulation (LIPUS) modulates microglial activation following intracortical microelectrode implantation. Low-intensity pulsed ultrasound stimulation (LIPUS) modulates microglial activation following intracortical microelectrode implantation. 2024; 15:5512. doi: 10.1038/s41467-024-49709-9"
R01CA281801,38331430,10896444,Evaluating CD133 as a Radiotheranostic Target in Small-Cell Lung Cancer.,Mol Pharm,2024,10.1021/acs.molpharmaceut.3c01063,10915790,[],"['Sarrett SM', 'Rodriguez C', 'Delaney S', 'Hosny MM', 'Sebastiano J', 'Santos-Coquillat A', 'Keinänen OM', 'Carter LM', 'Lastwika KJ', 'Lampe PD', 'Zeglis BM']","Sarrett SM, et al. Evaluating CD133 as a Radiotheranostic Target in Small-Cell Lung Cancer. Evaluating CD133 as a Radiotheranostic Target in Small-Cell Lung Cancer. 2024; 21:1402-1413. doi: 10.1021/acs.molpharmaceut.3c01063"
R01CA281682,38798647,10844584,Radiation-Induced Cellular Plasticity: A Strategy for Combatting Glioblastoma.,bioRxiv,2024,10.1101/2024.05.13.593985,11118449,[],"['He L', 'Azizad D', 'Bhat K', 'Ioannidis A', 'Hoffmann CJ', 'Arambula E', 'Bhaduri A', 'Kornblum HI', 'Pajonk F']","He L, et al. Radiation-Induced Cellular Plasticity: A Strategy for Combatting Glioblastoma. Radiation-Induced Cellular Plasticity: A Strategy for Combatting Glioblastoma. 2024; (unknown volume):(unknown pages). doi: 10.1101/2024.05.13.593985"
R01CA281682,40009641,10844584,Radiation-induced cellular plasticity primes glioblastoma for forskolin-mediated differentiation.,Proc Natl Acad Sci U S A,2025,10.1073/pnas.2415557122,11892679,[],"['He L', 'Azizad D', 'Bhat K', 'Ioannidis A', 'Hoffmann CJ', 'Arambula E', 'Eghbali M', 'Bhaduri A', 'Kornblum HI', 'Pajonk F']","He L, et al. Radiation-induced cellular plasticity primes glioblastoma for forskolin-mediated differentiation. Radiation-induced cellular plasticity primes glioblastoma for forskolin-mediated differentiation. 2025; 122:e2415557122. doi: 10.1073/pnas.2415557122"
R01CA293995,39430879,10973136,Early-life obesogenic environment integrates immunometabolic and epigenetic signatures governing neuroinflammation.,Brain Behav Immun Health,2024,10.1016/j.bbih.2024.100879,11490928,[],"['Ontiveros-Ángel P', 'Vega-Torres JD', 'Simon TB', 'Williams V', 'Inostroza-Nives Y', 'Alvarado-Crespo N', 'Gonzalez YV', 'Pompolius M', 'Katzka W', 'Lou J', 'Sharafeddin F', 'De la Peña I', 'Dong T', 'Gupta A', 'Viet CT', 'Febo M', 'Obenaus A', 'Nair A', 'Figueroa JD']","Ontiveros-Ángel P, et al. Early-life obesogenic environment integrates immunometabolic and epigenetic signatures governing neuroinflammation. Early-life obesogenic environment integrates immunometabolic and epigenetic signatures governing neuroinflammation. 2024; 42:100879. doi: 10.1016/j.bbih.2024.100879"
R01ES035504,26106137,10877363,Assessing the carcinogenic potential of low-dose exposures to chemical mixtures in the environment: focus on the cancer hallmark of tumor angiogenesis.,Carcinogenesis,2015,10.1093/carcin/bgv036,4492067,[],"['Hu Z', 'Brooks SA', 'Dormoy V', 'Hsu CW', 'Hsu HY', 'Lin LT', 'Massfelder T', 'Rathmell WK', 'Xia M', 'Al-Mulla F', 'Al-Temaimi R', 'Amedei A', 'Brown DG', 'Prudhomme KR', 'Colacci A', 'Hamid RA', 'Mondello C', 'Raju J', 'Ryan EP', 'Woodrick J', 'Scovassi AI', 'Singh N', 'Vaccari M', 'Roy R', 'Forte S', 'Memeo L', 'Salem HK', 'Lowe L', 'Jensen L', 'Bisson WH', 'Kleinstreuer N']","Hu Z, et al. Assessing the carcinogenic potential of low-dose exposures to chemical mixtures in the environment: focus on the cancer hallmark of tumor angiogenesis. Assessing the carcinogenic potential of low-dose exposures to chemical mixtures in the environment: focus on the cancer hallmark of tumor angiogenesis. 2015; 36 Suppl 1:S184-202. doi: 10.1093/carcin/bgv036"
R01CA199044,33377758,10998122,"Sparse-view, short-scan, dedicated cone-beam breast computed tomography: image quality assessment.",Biomed Phys Eng Express,2020,10.1088/2057-1976/abb834,8004539,[],"['Tseng HW', 'Karellas A', 'Vedantham S']","Tseng HW, et al. Sparse-view, short-scan, dedicated cone-beam breast computed tomography: image quality assessment. Sparse-view, short-scan, dedicated cone-beam breast computed tomography: image quality assessment. 2020; 6:(unknown pages). doi: 10.1088/2057-1976/abb834"
R01CA199044,35431425,10998122,Breast Cancer Screening: Opportunities and Challenges with Fully 3D Tomographic X-Ray Imaging.,Bridge (Wash D C),2022,,9012464,[],"['Vedantham S', 'Karellas A']",Vedantham S and Karellas A. Breast Cancer Screening: Opportunities and Challenges with Fully 3D Tomographic X-Ray Imaging. Breast Cancer Screening: Opportunities and Challenges with Fully 3D Tomographic X-Ray Imaging. 2022; 52:33-42.
R01CA199044,32361156,10998122,"Cone-beam breast computed tomography using ultra-fast image reconstruction with constrained, total-variation minimization for suppression of artifacts.",Phys Med,2020,10.1016/j.ejmp.2020.04.020,7295390,[],"['Tseng HW', 'Vedantham S', 'Karellas A']","Tseng HW, et al. Cone-beam breast computed tomography using ultra-fast image reconstruction with constrained, total-variation minimization for suppression of artifacts. Cone-beam breast computed tomography using ultra-fast image reconstruction with constrained, total-variation minimization for suppression of artifacts. 2020; 73:117-124. doi: 10.1016/j.ejmp.2020.04.020"
R01CA199044,32333575,10998122,Dedicated cone-beam breast CT using laterally-shifted detector geometry: Quantitative analysis of feasibility for clinical translation.,J Xray Sci Technol,2020,10.3233/XST-200651,7347391,[],"['Vedantham S', 'Tseng HW', 'Konate S', 'Shi L', 'Karellas A']","Vedantham S, et al. Dedicated cone-beam breast CT using laterally-shifted detector geometry: Quantitative analysis of feasibility for clinical translation. Dedicated cone-beam breast CT using laterally-shifted detector geometry: Quantitative analysis of feasibility for clinical translation. 2020; 28:405-426. doi: 10.3233/XST-200651"
R01CA199044,33373981,10998122,Optical conductivity of triple point fermions.,J Phys Condens Matter,2021,10.1088/1361-648X/abd739,,[],"['Habibi A', 'Farajollahpour T', 'Jafari SA']","Habibi A, et al. Optical conductivity of triple point fermions. Optical conductivity of triple point fermions. 2021; 33:(unknown pages). doi: 10.1088/1361-648X/abd739"
R01CA199044,38172250,10998122,An attenuation field network for dedicated cone beam breast CT with short scan and offset detector geometry.,Sci Rep,2024,10.1038/s41598-023-51077-1,10764954,[],"['Fu Z', 'Tseng HW', 'Vedantham S']","Fu Z, et al. An attenuation field network for dedicated cone beam breast CT with short scan and offset detector geometry. An attenuation field network for dedicated cone beam breast CT with short scan and offset detector geometry. 2024; 14:319. doi: 10.1038/s41598-023-51077-1"
R01CA199044,36427332,10998122,Dedicated cone-beam breast CT: Data acquisition strategies based on projection angle-dependent normalized glandular dose coefficients.,Med Phys,2023,10.1002/mp.16129,10207937,[],"['Tseng HW', 'Karellas A', 'Vedantham S']","Tseng HW, et al. Dedicated cone-beam breast CT: Data acquisition strategies based on projection angle-dependent normalized glandular dose coefficients. Dedicated cone-beam breast CT: Data acquisition strategies based on projection angle-dependent normalized glandular dose coefficients. 2023; 50:1406-1417. doi: 10.1002/mp.16129"
R01CA199044,29317032,10998122,Newer Technologies in Breast Cancer Imaging: Dedicated Cone-Beam Breast Computed Tomography.,Semin Ultrasound CT MR,2018,10.1053/j.sult.2017.09.001,5957539,[],"[""O'Connell AM"", 'Karellas A', 'Vedantham S', ""Kawakyu-O'Connor DT""]","O'Connell AM, et al. Newer Technologies in Breast Cancer Imaging: Dedicated Cone-Beam Breast Computed Tomography. Newer Technologies in Breast Cancer Imaging: Dedicated Cone-Beam Breast Computed Tomography. 2018; 39:106-113. doi: 10.1053/j.sult.2017.09.001"
R01CA199044,33273541,10998122,A residual dense network assisted sparse view reconstruction for breast computed tomography.,Sci Rep,2020,10.1038/s41598-020-77923-0,7713379,[],"['Fu Z', 'Tseng HW', 'Vedantham S', 'Karellas A', 'Bilgin A']","Fu Z, et al. A residual dense network assisted sparse view reconstruction for breast computed tomography. A residual dense network assisted sparse view reconstruction for breast computed tomography. 2020; 10:21111. doi: 10.1038/s41598-020-77923-0"
R01CA199044,29159941,10998122,The role of off-focus radiation in scatter correction for dedicated cone beam breast CT.,Med Phys,2018,10.1002/mp.12686,5985236,[],"['Shi L', 'Vedantham S', 'Karellas A', 'Zhu L']","Shi L, et al. The role of off-focus radiation in scatter correction for dedicated cone beam breast CT. The role of off-focus radiation in scatter correction for dedicated cone beam breast CT. 2018; 45:191-201. doi: 10.1002/mp.12686"
R01CA199044,35316793,10998122,Cone-beam breast CT using an offset detector: effect of detector offset and image reconstruction algorithm.,Phys Med Biol,2022,10.1088/1361-6560/ac5fe1,9045275,[],"['Tseng HW', 'Karellas A', 'Vedantham S']","Tseng HW, et al. Cone-beam breast CT using an offset detector: effect of detector offset and image reconstruction algorithm. Cone-beam breast CT using an offset detector: effect of detector offset and image reconstruction algorithm. 2022; 67:(unknown pages). doi: 10.1088/1361-6560/ac5fe1"
R01ES035504,25560674,10877363,Predicting chemically-induced skin reactions. Part I: QSAR models of skin sensitization and their application to identify potentially hazardous compounds.,Toxicol Appl Pharmacol,2015,10.1016/j.taap.2014.12.014,4546933,[],"['Alves VM', 'Muratov E', 'Fourches D', 'Strickland J', 'Kleinstreuer N', 'Andrade CH', 'Tropsha A']","Alves VM, et al. Predicting chemically-induced skin reactions. Part I: QSAR models of skin sensitization and their application to identify potentially hazardous compounds. Predicting chemically-induced skin reactions. Part I: QSAR models of skin sensitization and their application to identify potentially hazardous compounds. 2015; 284:262-72. doi: 10.1016/j.taap.2014.12.014"
R01CA275015,38530135,10885188,Lung CT harmonization of paired reconstruction kernel images using generative adversarial networks.,Med Phys,2024,10.1002/mp.17028,11321937,[],"['Krishnan AR', 'Xu K', 'Li TZ', 'Remedios LW', 'Sandler KL', 'Maldonado F', 'Landman BA']","Krishnan AR, et al. Lung CT harmonization of paired reconstruction kernel images using generative adversarial networks. Lung CT harmonization of paired reconstruction kernel images using generative adversarial networks. 2024; 51:5510-5523. doi: 10.1002/mp.17028"
R56AI187162,39773847,11118330,Role of follicular homing natural killer cells in HIV infection.,Curr Opin HIV AIDS,2025,10.1097/COH.0000000000000916,11802284,[],"['Ponnan SM', 'Govindaraj S', 'Velu V']","Ponnan SM, et al. Role of follicular homing natural killer cells in HIV infection. Role of follicular homing natural killer cells in HIV infection. 2025; 20:154-158. doi: 10.1097/COH.0000000000000916"
R01CA276525,39276774,11062923,Intercellular nanotube-mediated mitochondrial transfer enhances T cell metabolic fitness and antitumor efficacy.,Cell,2024,10.1016/j.cell.2024.08.029,11623344,[],"['Baldwin JG', 'Heuser-Loy C', 'Saha T', 'Schelker RC', 'Slavkovic-Lukic D', 'Strieder N', 'Hernandez-Lopez I', 'Rana N', 'Barden M', 'Mastrogiovanni F', 'Martín-Santos A', 'Raimondi A', 'Brohawn P', 'Higgs BW', 'Gebhard C', 'Kapoor V', 'Telford WG', 'Gautam S', 'Xydia M', 'Beckhove P', 'Frischholz S', 'Schober K', 'Kontarakis Z', 'Corn JE', 'Iannacone M', 'Inverso D', 'Rehli M', 'Fioravanti J', 'Sengupta S', 'Gattinoni L']","Baldwin JG, et al. Intercellular nanotube-mediated mitochondrial transfer enhances T cell metabolic fitness and antitumor efficacy. Intercellular nanotube-mediated mitochondrial transfer enhances T cell metabolic fitness and antitumor efficacy. 2024; 187:6614-6630.e21. doi: 10.1016/j.cell.2024.08.029"
R01CA286120,38706638,10981894,Assessment of Volumetric Dense Tissue Segmentation in Tomosynthesis Using Deep Virtual Clinical Trials.,Pattern Recognit,2024,10.1016/j.patcog.2024.110494,11065113,[],"['Barufaldi B', 'Gomes JV', 'Filho TS', 'do Rêgo TG', 'Malheiros Y', 'Vent TL', 'Gastounioti A', 'Maidment A']","Barufaldi B, et al. Assessment of Volumetric Dense Tissue Segmentation in Tomosynthesis Using Deep Virtual Clinical Trials. Assessment of Volumetric Dense Tissue Segmentation in Tomosynthesis Using Deep Virtual Clinical Trials. 2024; 153:(unknown pages). doi: 10.1016/j.patcog.2024.110494"
R01EY029023,31868851,11050128,Application of Corneal Optical Coherence Tomography Angiography for Assessment of Vessel Depth in Corneal Neovascularization.,Cornea,2020,10.1097/ICO.0000000000002232,7179392,[],"['Nanji A', 'Redd T', 'Chamberlain W', 'Schallhorn JM', 'Chen S', 'Ploner S', 'Maier A', 'Fujimoto JG', 'Jia Y', 'Huang D', 'Li Y']","Nanji A, et al. Application of Corneal Optical Coherence Tomography Angiography for Assessment of Vessel Depth in Corneal Neovascularization. Application of Corneal Optical Coherence Tomography Angiography for Assessment of Vessel Depth in Corneal Neovascularization. 2020; 39:598-604. doi: 10.1097/ICO.0000000000002232"
R01CA248323,33536314,11133363,Mapping proteolytic neo-N termini at the surface of living cells.,Proc Natl Acad Sci U S A,2021,10.1073/pnas.2018809118,7923363,[],"['Weeks AM', 'Byrnes JR', 'Lui I', 'Wells JA']","Weeks AM, et al. Mapping proteolytic neo-N termini at the surface of living cells. Mapping proteolytic neo-N termini at the surface of living cells. 2021; 118:(unknown pages). doi: 10.1073/pnas.2018809118"
U01AI125051,38367616,11087744,Selection of epigenetically privileged HIV-1 proviruses during treatment with panobinostat and interferon-α2a.,Cell,2024,10.1016/j.cell.2024.01.037,10903630,[],"['Armani-Tourret M', 'Gao C', 'Hartana CA', 'Sun W', 'Carrere L', 'Vela L', 'Hochroth A', 'Bellefroid M', 'Sbrolla A', 'Shea K', 'Flynn T', 'Roseto I', 'Rassadkina Y', 'Lee C', 'Giguel F', 'Malhotra R', 'Bushman FD', 'Gandhi RT', 'Yu XG', 'Kuritzkes DR', 'Lichterfeld M']","Armani-Tourret M, et al. Selection of epigenetically privileged HIV-1 proviruses during treatment with panobinostat and interferon-α2a. Selection of epigenetically privileged HIV-1 proviruses during treatment with panobinostat and interferon-α2a. 2024; 187:1238-1254.e14. doi: 10.1016/j.cell.2024.01.037"
R01DC016834,31091111,11048686,Variations Within Normal Hearing Acuity and Speech Comprehension: An Exploratory Study.,Am J Audiol,2019,10.1044/2019_AJA-18-0173,6802869,[],"['Ayasse ND', 'Penn LR', 'Wingfield A']","Ayasse ND, et al. Variations Within Normal Hearing Acuity and Speech Comprehension: An Exploratory Study. Variations Within Normal Hearing Acuity and Speech Comprehension: An Exploratory Study. 2019; 28:369-375. doi: 10.1044/2019_AJA-18-0173"
R01DC016834,36908889,11048686,Hemispheric dissociations in regions supporting auditory sentence comprehension in older adults.,Aging Brain,2022,10.1016/j.nbas.2022.100051,9997128,[],"['Lee YS', 'Rogers CS', 'Grossman M', 'Wingfield A', 'Peelle JE']","Lee YS, et al. Hemispheric dissociations in regions supporting auditory sentence comprehension in older adults. Hemispheric dissociations in regions supporting auditory sentence comprehension in older adults. 2022; 2:100051. doi: 10.1016/j.nbas.2022.100051"
R01NS102917,29203409,10883380,Nanoelectronics enabled chronic multimodal neural platform in a mouse ischemic model.,J Neurosci Methods,2018,10.1016/j.jneumeth.2017.12.001,5801157,[],"['Luan L', 'Sullender CT', 'Li X', 'Zhao Z', 'Zhu H', 'Wei X', 'Xie C', 'Dunn AK']","Luan L, et al. Nanoelectronics enabled chronic multimodal neural platform in a mouse ischemic model. Nanoelectronics enabled chronic multimodal neural platform in a mouse ischemic model. 2018; 295:68-76. doi: 10.1016/j.jneumeth.2017.12.001"
R01NS102917,32494746,10883380,Multimodal mapping of neural activity and cerebral blood flow reveals long-lasting neurovascular dissociations after small-scale strokes.,Sci Adv,2020,10.1126/sciadv.aba1933,7244270,[],"['He F', 'Sullender CT', 'Zhu H', 'Williamson MR', 'Li X', 'Zhao Z', 'Jones TA', 'Xie C', 'Dunn AK', 'Luan L']","He F, et al. Multimodal mapping of neural activity and cerebral blood flow reveals long-lasting neurovascular dissociations after small-scale strokes. Multimodal mapping of neural activity and cerebral blood flow reveals long-lasting neurovascular dissociations after small-scale strokes. 2020; 6:eaba1933. doi: 10.1126/sciadv.aba1933"
R01NS105691,34690420,11055066,Recent advances in neural interfaces-Materials chemistry to clinical translation.,MRS Bull,2020,10.1557/mrs.2020.195,8536148,[],"['Bettinger CJ', 'Ecker M', 'Kozai TDY', 'Malliaras GG', 'Meng E', 'Voit W']","Bettinger CJ, et al. Recent advances in neural interfaces-Materials chemistry to clinical translation. Recent advances in neural interfaces-Materials chemistry to clinical translation. 2020; 45:655-668. doi: 10.1557/mrs.2020.195"
R01AI183314,39688412,11125744,Interactions of the emerging fungus Candida auris with Acanthamoeba castellanii reveal phenotypic changes with direct implications on the response to stress and virulence.,Microbiol Spectr,2025,10.1128/spectrum.01746-24,11792492,[],"['Valente MR', 'Martins Alcântara L', 'Cintra DS', 'Mendoza SR', 'Medeiros EG', 'Gomes KX', 'Honorato L', 'Almeida MdA', 'Vieira CB', 'Nosanchuk JD', 'Sgarbi DBdG', 'Pinto MR', 'Nimrichter L', 'Guimarães AJ']","Valente MR, et al. Interactions of the emerging fungus Candida auris with Acanthamoeba castellanii reveal phenotypic changes with direct implications on the response to stress and virulence. Interactions of the emerging fungus Candida auris with Acanthamoeba castellanii reveal phenotypic changes with direct implications on the response to stress and virulence. 2025; 13:e0174624. doi: 10.1128/spectrum.01746-24"
R01AI183314,39370781,11125744,Alkaloids solenopsins from fire ants display in vitro and in vivo activity against the yeast Candida auris.,Virulence,2024,10.1080/21505594.2024.2413329,11469440,[],"['Honorato L', 'Artunduaga Bonilla JJ', 'Ribeiro da Silva L', 'Kornetz J', 'Zamith-Miranda D', 'Valdez AF', 'Nosanchuk JD', 'Gonçalves Paterson Fox E', 'Nimrichter L']","Honorato L, et al. Alkaloids solenopsins from fire ants display in vitro and in vivo activity against the yeast Candida auris. Alkaloids solenopsins from fire ants display in vitro and in vivo activity against the yeast Candida auris. 2024; 15:2413329. doi: 10.1080/21505594.2024.2413329"
R01CA282022,39417716,10884411,N-Linked Fucosylated Glycans Are Biomarkers for Prostate Cancer with a Neuroendocrine and Metastatic Phenotype.,Mol Cancer Res,2025,10.1158/1541-7786.MCR-24-0660,11694069,[],"['Ippolito JE', 'Hartig JP', 'Bejar K', 'Nakhoul H', 'Sehn JK', 'Weimholt C', 'Grimsley G', 'Nunez E', 'Trikalinos NA', 'Chatterjee D', 'Kim EH', 'Mehta AS', 'Angel PM', 'Troyer DA', 'Leach RJ', 'Corey E', 'Wu JD', 'Drake RR']","Ippolito JE, et al. N-Linked Fucosylated Glycans Are Biomarkers for Prostate Cancer with a Neuroendocrine and Metastatic Phenotype. N-Linked Fucosylated Glycans Are Biomarkers for Prostate Cancer with a Neuroendocrine and Metastatic Phenotype. 2025; 23:59-70. doi: 10.1158/1541-7786.MCR-24-0660"
U01AI125051,28366768,11087744,Evolving Gene Therapy in Primary Immunodeficiency.,Mol Ther,2017,10.1016/j.ymthe.2017.03.018,5417846,[],"['Thrasher AJ', 'Williams DA']",Thrasher AJ and Williams DA. Evolving Gene Therapy in Primary Immunodeficiency. Evolving Gene Therapy in Primary Immunodeficiency. 2017; 25:1132-1141. doi: 10.1016/j.ymthe.2017.03.018
R01CA283826,39905264,11055342,Implantation of engineered adipocytes suppresses tumor progression in cancer models.,Nat Biotechnol,2025,10.1038/s41587-024-02551-2,,[],"['Nguyen HP', 'An K', 'Ito Y', 'Kharbikar BN', 'Sheng R', 'Paredes B', 'Murray E', 'Pham K', 'Bruck M', 'Zhou X', 'Biellak C', 'Ushiki A', 'Nobuhara M', 'Fong SL', 'Bernards DA', 'Lynce F', 'Dillon DA', 'Magbanua MJM', 'Huppert LA', 'Hammerlindl H', 'Klein JA', 'Valdiviez L', 'Fiehn O', 'Esserman L', 'Desai TA', 'Yee SW', 'Rosenbluth JM', 'Ahituv N']","Nguyen HP, et al. Implantation of engineered adipocytes suppresses tumor progression in cancer models. Implantation of engineered adipocytes suppresses tumor progression in cancer models. 2025; (unknown volume):(unknown pages). doi: 10.1038/s41587-024-02551-2"
R01CA286120,39652797,10981894,Volumetric Breast Density Estimation From Three-Dimensional Reconstructed Digital Breast Tomosynthesis Images Using Deep Learning.,JCO Clin Cancer Inform,2024,10.1200/CCI.24.00103,11643139,[],"['Ahluwalia VS', 'Doiphode N', 'Mankowski WC', 'Cohen EA', 'Pati S', 'Pantalone L', 'Bakas S', 'Brooks A', 'Vachon CM', 'Conant EF', 'Gastounioti A', 'Kontos D']","Ahluwalia VS, et al. Volumetric Breast Density Estimation From Three-Dimensional Reconstructed Digital Breast Tomosynthesis Images Using Deep Learning. Volumetric Breast Density Estimation From Three-Dimensional Reconstructed Digital Breast Tomosynthesis Images Using Deep Learning. 2024; 8:e2400103. doi: 10.1200/CCI.24.00103"
R01AI186809,39373535,11009423,CD4 downregulation precedes Env expression and protects HIV-1-infected cells from ADCC mediated by non-neutralizing antibodies.,mBio,2024,10.1128/mbio.01827-24,11559134,[],"['Richard J', 'Sannier G', 'Zhu L', 'Prévost J', 'Marchitto L', 'Benlarbi M', 'Beaudoin-Bussières G', 'Kim H', 'Sun Y', 'Chatterjee D', 'Medjahed H', 'Bourassa C', 'Delgado G-G', 'Dubé M', 'Kirchhoff F', 'Hahn BH', 'Kumar P', 'Kaufmann DE', 'Finzi A']","Richard J, et al. CD4 downregulation precedes Env expression and protects HIV-1-infected cells from ADCC mediated by non-neutralizing antibodies. CD4 downregulation precedes Env expression and protects HIV-1-infected cells from ADCC mediated by non-neutralizing antibodies. 2024; 15:e0182724. doi: 10.1128/mbio.01827-24"
R01CA248323,36454758,11133363,MEK inhibition enhances presentation of targetable MHC-I tumor antigens in mutant melanomas.,Proc Natl Acad Sci U S A,2022,10.1073/pnas.2208900119,9894220,[],"['Stopfer LE', 'Rettko NJ', 'Leddy O', 'Mesfin JM', 'Brown E', 'Winski S', 'Bryson B', 'Wells JA', 'White FM']","Stopfer LE, et al. MEK inhibition enhances presentation of targetable MHC-I tumor antigens in mutant melanomas. MEK inhibition enhances presentation of targetable MHC-I tumor antigens in mutant melanomas. 2022; 119:e2208900119. doi: 10.1073/pnas.2208900119"
U01AI125051,37478401,11087744,Outcomes of hematopoietic stem cell gene therapy for Wiskott-Aldrich syndrome.,Blood,2023,10.1182/blood.2022019117,10731922,[],"['Labrosse R', 'Chu JI', 'Armant MA', 'Everett JK', 'Pellin D', 'Kareddy N', 'Frelinger AL', 'Henderson LA', ""O'Connell AE"", 'Biswas A', 'Coenen-van der Spek J', 'Miggelbrink A', 'Fiorini C', 'Adhikari H', 'Berry CC', 'Cantu VA', 'Fong J', 'Jaroslavsky J', 'Karadeniz DF', 'Li QZ', 'Reddy S', 'Roche AM', 'Zhu C', 'Whangbo JS', 'Dansereau C', 'Mackinnon B', 'Morris E', 'Koo SM', 'London WB', 'Baris S', 'Ozen A', 'Karakoc-Aydiner E', 'Despotovic JM', 'Forbes Satter LR', 'Saitoh A', 'Aizawa Y', 'King A', 'Nguyen MAT', 'Vu VDU', 'Snapper SB', 'Galy A', 'Notarangelo LD', 'Bushman FD', 'Williams DA', 'Pai SY']","Labrosse R, et al. Outcomes of hematopoietic stem cell gene therapy for Wiskott-Aldrich syndrome. Outcomes of hematopoietic stem cell gene therapy for Wiskott-Aldrich syndrome. 2023; 142:1281-1296. doi: 10.1182/blood.2022019117"
R01NS105691,37244370,11055066,Dynamic amplitude modulation of microstimulation evokes biomimetic onset and offset transients and reduces depression of evoked calcium responses in sensory cortices.,Brain Stimul,2023,10.1016/j.brs.2023.05.013,10330928,[],"['Hughes C', 'Kozai T']",Hughes C and Kozai T. Dynamic amplitude modulation of microstimulation evokes biomimetic onset and offset transients and reduces depression of evoked calcium responses in sensory cortices. Dynamic amplitude modulation of microstimulation evokes biomimetic onset and offset transients and reduces depression of evoked calcium responses in sensory cortices. 2023; 16:939-965. doi: 10.1016/j.brs.2023.05.013
R01CA282022,39347566,10884411,Determining the N-Glycan and Collagen/Extracellular Matrix Protein Compositions in a Novel Outcome Cohort of Prostate Cancer Tissue Microarrays Using MALDI-MSI.,Cancer Res Commun,2024,10.1158/2767-9764.CRC-24-0152,11600299,[],"['Hartig JP', 'Bejar K', 'Young LEA', 'Grimsley G', 'Bethard JR', 'Troyer DA', 'Hernandez J', 'Wu JD', 'Ippolito JE', 'Ball LE', 'Gelfond JAL', 'Johnson-Pais TL', 'Mehta AS', 'Leach RJ', 'Angel PM', 'Drake RR']","Hartig JP, et al. Determining the N-Glycan and Collagen/Extracellular Matrix Protein Compositions in a Novel Outcome Cohort of Prostate Cancer Tissue Microarrays Using MALDI-MSI. Determining the N-Glycan and Collagen/Extracellular Matrix Protein Compositions in a Novel Outcome Cohort of Prostate Cancer Tissue Microarrays Using MALDI-MSI. 2024; 4:3036-3048. doi: 10.1158/2767-9764.CRC-24-0152"
