coreproject,pmid,applid,title,journal,year,doi,pmc,grants,authors,citation
R01EY028666,30055838,10802911,Distinguishing Highly Asymmetric Keratoconus Eyes Using Combined Scheimpflug and Spectral-Domain OCT Analysis.,Ophthalmology,2018,10.1016/j.ophtha.2018.06.020,6246819,[],"['Hwang ES', 'Perez-Straziota CE', 'Kim SW', 'Santhiago MR', 'Randleman JB']","Hwang ES, et al. Distinguishing Highly Asymmetric Keratoconus Eyes Using Combined Scheimpflug and Spectral-Domain OCT Analysis. Distinguishing Highly Asymmetric Keratoconus Eyes Using Combined Scheimpflug and Spectral-Domain OCT Analysis. 2018; 125:1862-1871. doi: 10.1016/j.ophtha.2018.06.020"
R01EY028666,39504051,10802911,Determining the Relationship Between Corneal Stiffening and Tissue Dehydration After Corneal Cross-Linking.,Invest Ophthalmol Vis Sci,2024,10.1167/iovs.65.13.14,11549923,[],"['Rodríguez-López R', 'Webb JN', 'Erdi M', 'Kofinas P', 'Franco W', 'Zhang H', 'Randleman JB', 'Scarcelli G']","Rodríguez-López R, et al. Determining the Relationship Between Corneal Stiffening and Tissue Dehydration After Corneal Cross-Linking. Determining the Relationship Between Corneal Stiffening and Tissue Dehydration After Corneal Cross-Linking. 2024; 65:14. doi: 10.1167/iovs.65.13.14"
R01EY028666,30721688,10802911,Distinguishing Highly Asymmetric Keratoconus Eyes Using Dual Scheimpflug/Placido Analysis.,Am J Ophthalmol,2019,10.1016/j.ajo.2019.01.023,6511474,[],"['Golan O', 'Piccinini AL', 'Hwang ES', 'De Oca Gonzalez IM', 'Krauthammer M', 'Khandelwal SS', 'Smadja D', 'Randleman JB']","Golan O, et al. Distinguishing Highly Asymmetric Keratoconus Eyes Using Dual Scheimpflug/Placido Analysis. Distinguishing Highly Asymmetric Keratoconus Eyes Using Dual Scheimpflug/Placido Analysis. 2019; 201:46-53. doi: 10.1016/j.ajo.2019.01.023"
R01EY028666,36589595,10802911,Motion-tracking Brillouin microscopy for in-vivo corneal biomechanics mapping.,Biomed Opt Express,2022,10.1364/BOE.472053,9774862,[],"['Zhang H', 'Asroui L', 'Randleman JB', 'Scarcelli G']","Zhang H, et al. Motion-tracking Brillouin microscopy for in-vivo corneal biomechanics mapping. Motion-tracking Brillouin microscopy for in-vivo corneal biomechanics mapping. 2022; 13:6196-6210. doi: 10.1364/BOE.472053"
R01EY028666,37839561,10802911,Subclinical Keratoconus Detection and Characterization Using Motion-Tracking Brillouin Microscopy.,Ophthalmology,2024,10.1016/j.ophtha.2023.10.011,11117393,[],"['Randleman JB', 'Zhang H', 'Asroui L', 'Tarib I', 'Dupps WJ', 'Scarcelli G']","Randleman JB, et al. Subclinical Keratoconus Detection and Characterization Using Motion-Tracking Brillouin Microscopy. Subclinical Keratoconus Detection and Characterization Using Motion-Tracking Brillouin Microscopy. 2024; 131:310-321. doi: 10.1016/j.ophtha.2023.10.011"
R01EY028666,38975030,10802911,Functional effects of the spatial-varying lens mechanical properties in accommodation.,JPhys Photonics,2024,10.1088/2515-7647/ad3e55,11223182,[],"['Schumacher J', 'Lopez RR', 'Larin K', 'Manns F', 'Scarcelli G']","Schumacher J, et al. Functional effects of the spatial-varying lens mechanical properties in accommodation. Functional effects of the spatial-varying lens mechanical properties in accommodation. 2024; 6:035021. doi: 10.1088/2515-7647/ad3e55"
R01EY028666,31710374,10802911,Depth-Dependent Reduction of Biomechanical Efficacy of Contact Lens-Assisted Corneal Cross-linking Analyzed by Brillouin Microscopy.,J Refract Surg,2019,10.3928/1081597X-20191004-01,7767636,[],"['Zhang H', 'Roozbahani M', 'Piccinini AL', 'Golan O', 'Hafezi F', 'Scarcelli G', 'Randleman JB']","Zhang H, et al. Depth-Dependent Reduction of Biomechanical Efficacy of Contact Lens-Assisted Corneal Cross-linking Analyzed by Brillouin Microscopy. Depth-Dependent Reduction of Biomechanical Efficacy of Contact Lens-Assisted Corneal Cross-linking Analyzed by Brillouin Microscopy. 2019; 35:721-728. doi: 10.3928/1081597X-20191004-01"
R01EY028666,36963605,10802911,"Motion-Tracking Brillouin Microscopy Evaluation of Normal, Keratoconic, and Post-Laser Vision Correction Corneas.",Am J Ophthalmol,2023,10.1016/j.ajo.2023.03.018,11108093,[],"['Zhang H', 'Asroui L', 'Tarib I', 'Dupps WJ', 'Scarcelli G', 'Randleman JB']","Zhang H, et al. Motion-Tracking Brillouin Microscopy Evaluation of Normal, Keratoconic, and Post-Laser Vision Correction Corneas. Motion-Tracking Brillouin Microscopy Evaluation of Normal, Keratoconic, and Post-Laser Vision Correction Corneas. 2023; 254:128-140. doi: 10.1016/j.ajo.2023.03.018"
R01EY028666,33149067,10802911,Brillouin microscopic depth-dependent analysis of corneal crosslinking performed over or under the LASIK flap.,J Cataract Refract Surg,2020,10.1097/j.jcrs.0000000000000294,7721035,[],"['Zhang H', 'Roozbahani M', 'Piccinini AL', 'Hafezi F', 'Scarcelli G', 'Randleman JB']","Zhang H, et al. Brillouin microscopic depth-dependent analysis of corneal crosslinking performed over or under the LASIK flap. Brillouin microscopic depth-dependent analysis of corneal crosslinking performed over or under the LASIK flap. 2020; 46:1543-1547. doi: 10.1097/j.jcrs.0000000000000294"
R01EY028666,30690129,10802911,Validation of the Percent Tissue Altered as a Risk Factor for Ectasia after LASIK.,Ophthalmology,2019,10.1016/j.ophtha.2019.01.018,,[],"['Santhiago MR', 'Wilson SE', 'Smadja D', 'Chamon W', 'Krueger RE', 'Randleman JB']","Santhiago MR, et al. Validation of the Percent Tissue Altered as a Risk Factor for Ectasia after LASIK. Validation of the Percent Tissue Altered as a Risk Factor for Ectasia after LASIK. 2019; 126:908-909. doi: 10.1016/j.ophtha.2019.01.018"
R21MD019768,38315943,10949665,From Clinical Trials to Practice: Anticipating and Overcoming Challenges in Implementing Watch-and-Wait for Rectal Cancer.,J Clin Oncol,2024,10.1200/JCO.23.01369,,[],"['Loria A', 'Ramsdale EE', 'Aquina CT', 'Cupertino P', 'Mohile SG', 'Fleming FJ']","Loria A, et al. From Clinical Trials to Practice: Anticipating and Overcoming Challenges in Implementing Watch-and-Wait for Rectal Cancer. From Clinical Trials to Practice: Anticipating and Overcoming Challenges in Implementing Watch-and-Wait for Rectal Cancer. 2024; 42:876-880. doi: 10.1200/JCO.23.01369"
R01AI183353,39793739,10895606,MicroRNA biomarkers and host response pathways in severe pulmonary hemorrhagic syndrome due to leptospirosis: A multi-omics study.,J Infect,2025,10.1016/j.jinf.2024.106400,11966573,[],"['Tran PNT', 'Limothai U', 'Dinhuzen J', 'Tachaboon S', 'Sukmark T', 'Dokpong C', 'Roytrakul S', 'Haake DA', 'Srisawat N']","Tran PNT, et al. MicroRNA biomarkers and host response pathways in severe pulmonary hemorrhagic syndrome due to leptospirosis: A multi-omics study. MicroRNA biomarkers and host response pathways in severe pulmonary hemorrhagic syndrome due to leptospirosis: A multi-omics study. 2025; 90:106400. doi: 10.1016/j.jinf.2024.106400"
R01CA284565,39476547,10996979,53BP1-the 'Pandora's box' of genome integrity.,DNA Repair (Amst),2024,10.1016/j.dnarep.2024.103779,11611608,[],"['Kilgas S', 'Swift ML', 'Chowdhury D']","Kilgas S, et al. 53BP1-the 'Pandora's box' of genome integrity. 53BP1-the 'Pandora's box' of genome integrity. 2024; 144:103779. doi: 10.1016/j.dnarep.2024.103779"
R01NS129738,38623583,10846861,Design of a Sleep Modulation System with FPGA-Accelerated Deep Learning for Closed-loop Stage-Specific In-Phase Auditory Stimulation.,IEEE Int Symp Circuits Syst Proc,2023,10.1109/ISCAS46773.2023.10181356,11018328,[],"['Sun M', 'Zhou A', 'Yang N', 'Xu Y', 'Hou Y', 'Richardson AG', 'Liu X']","Sun M, et al. Design of a Sleep Modulation System with FPGA-Accelerated Deep Learning for Closed-loop Stage-Specific In-Phase Auditory Stimulation. Design of a Sleep Modulation System with FPGA-Accelerated Deep Learning for Closed-loop Stage-Specific In-Phase Auditory Stimulation. 2023; 2023:(unknown pages). doi: 10.1109/ISCAS46773.2023.10181356"
R01CA248323,38292613,11133363,Photoproximity Labeling from Single Catalyst Sites Allows Calibration and Increased Resolution for Carbene Labeling of Protein Partners In Vitro and on Cells.,ACS Cent Sci,2024,10.1021/acscentsci.3c01473,10823516,[],"['Bartholow TG', 'Burroughs PWW', 'Elledge SK', 'Byrnes JR', 'Kirkemo LL', 'Garda V', 'Leung KK', 'Wells JA']","Bartholow TG, et al. Photoproximity Labeling from Single Catalyst Sites Allows Calibration and Increased Resolution for Carbene Labeling of Protein Partners In Vitro and on Cells. Photoproximity Labeling from Single Catalyst Sites Allows Calibration and Increased Resolution for Carbene Labeling of Protein Partners In Vitro and on Cells. 2024; 10:199-208. doi: 10.1021/acscentsci.3c01473"
R01CA293995,39059870,10973136,Benefits and Controversies of Midface and Maxillary Reconstruction.,Atlas Oral Maxillofac Surg Clin North Am,2024,10.1016/j.cxom.2023.12.006,,[],"['Callahan N', 'Pu JJ', 'Richard Su YX', 'Zbarsky SJD', 'Weyh A', 'Viet CT']","Callahan N, et al. Benefits and Controversies of Midface and Maxillary Reconstruction. Benefits and Controversies of Midface and Maxillary Reconstruction. 2024; 32:109-116. doi: 10.1016/j.cxom.2023.12.006"
R01CA293995,38869038,10973136,Single-Cell Molecular Profiling of Head and Neck Squamous Cell Carcinoma Reveals Five Dysregulated Signaling Pathways Associated With Circulating Tumor Cells.,Cancer Control,2024,10.1177/10732748241251571,11179551,[],"['Stucky A', 'Viet CT', 'Aouizerat BE', 'Ye Y', 'Doan C', 'Mundluru T', 'Sedhiazadeh P', 'Sinha UK', 'Chen X', 'Zhang X', 'Li SC', 'Cai J', 'Zhong JF']","Stucky A, et al. Single-Cell Molecular Profiling of Head and Neck Squamous Cell Carcinoma Reveals Five Dysregulated Signaling Pathways Associated With Circulating Tumor Cells. Single-Cell Molecular Profiling of Head and Neck Squamous Cell Carcinoma Reveals Five Dysregulated Signaling Pathways Associated With Circulating Tumor Cells. 2024; 31:10732748241251571. doi: 10.1177/10732748241251571"
R01CA293995,39818638,10973136,Multi-institutional retrospective study on opioid prescribing patterns of oral and maxillofacial surgeons.,J Am Dent Assoc,2025,10.1016/j.adaj.2024.11.009,11798687,[],"['Zbarsky SJD', 'Hanna IA', 'Ryu JD', 'Boehm A', 'Young S', 'Yu G', 'Dong MP', 'Tran MCJ', 'Herford A', 'Young S', 'Viet CT']","Zbarsky SJD, et al. Multi-institutional retrospective study on opioid prescribing patterns of oral and maxillofacial surgeons. Multi-institutional retrospective study on opioid prescribing patterns of oral and maxillofacial surgeons. 2025; 156:124-132.e1. doi: 10.1016/j.adaj.2024.11.009"
R01CA293995,39821751,10973136,"Depression, non-medical pain prescriptions, and suicidal behavior in cancer survivors.",J Cancer Surviv,2025,10.1007/s11764-024-01740-x,,[],"['Mwobobia J', 'White MC', 'Osazuwa-Peters OL', 'Adjei Boakye E', 'Abouelella DK', 'Barnes JM', 'Viet CT', 'Ramos K', 'Corbett C', 'Osazuwa-Peters N']","Mwobobia J, et al. Depression, non-medical pain prescriptions, and suicidal behavior in cancer survivors. Depression, non-medical pain prescriptions, and suicidal behavior in cancer survivors. 2025; (unknown volume):(unknown pages). doi: 10.1007/s11764-024-01740-x"
R01ES030380,38463029,10980804,Public library lending programs increase radon testing in rural communities.,Libr Inf Sci Res,2024,10.1016/j.lisr.2024.101283,10919551,[],"['Stanifer SR', 'Rademacher K', 'Beckett W', 'Simpson K', 'Rayens MK', 'Thaxton-Wiggins A', 'Hahn EJ']","Stanifer SR, et al. Public library lending programs increase radon testing in rural communities. Public library lending programs increase radon testing in rural communities. 2024; 46:(unknown pages). doi: 10.1016/j.lisr.2024.101283"
R01ES030380,37701077,10980804,"Geologic, seasonal, and atmospheric predictors of indoor home radon values.",Environ Res Health,2023,10.1088/2752-5309/acdcb3,10496436,[],"['Hahn EJ', 'Haneberg WC', 'Stanifer SR', 'Rademacher K', 'Backus J', 'Rayens MK']","Hahn EJ, et al. Geologic, seasonal, and atmospheric predictors of indoor home radon values. Geologic, seasonal, and atmospheric predictors of indoor home radon values. 2023; 1:(unknown pages). doi: 10.1088/2752-5309/acdcb3"
R01CA248323,38062152,11133363,Extracellular targeted protein degradation: an emerging modality for drug discovery.,Nat Rev Drug Discov,2024,10.1038/s41573-023-00833-z,,[],"['Wells JA', 'Kumru K']",Wells JA and Kumru K. Extracellular targeted protein degradation: an emerging modality for drug discovery. Extracellular targeted protein degradation: an emerging modality for drug discovery. 2024; 23:126-140. doi: 10.1038/s41573-023-00833-z
R01AR083139,39415002,11084392,A prenatal skin atlas reveals immune regulation of human skin morphogenesis.,Nature,2024,10.1038/s41586-024-08002-x,11578897,[],"['Gopee NH', 'Winheim E', 'Olabi B', 'Admane C', 'Foster AR', 'Huang N', 'Botting RA', 'Torabi F', 'Sumanaweera D', 'Le AP', 'Kim J', 'Verger L', 'Stephenson E', 'Adão D', 'Ganier C', 'Gim KY', 'Serdy SA', 'Deakin C', 'Goh I', 'Steele L', 'Annusver K', 'Miah MU', 'Tun WM', 'Moghimi P', 'Kwakwa KA', 'Li T', 'Basurto Lozada D', 'Rumney B', 'Tudor CL', 'Roberts K', 'Chipampe NJ', 'Sidhpura K', 'Englebert J', 'Jardine L', 'Reynolds G', 'Rose A', 'Rowe V', 'Pritchard S', 'Mulas I', 'Fletcher J', 'Popescu DM', 'Poyner E', 'Dubois A', 'Guy A', 'Filby A', 'Lisgo S', 'Barker RA', 'Glass IA', 'Park JE', 'Vento-Tormo R', 'Nikolova MT', 'He P', 'Lawrence JEG', 'Moore J', 'Ballereau S', 'Hale CB', 'Shanmugiah V', 'Horsfall D', 'Rajan N', 'McGrath JA', ""O'Toole EA"", 'Treutlein B', 'Bayraktar O', 'Kasper M', 'Progatzky F', 'Mazin P', 'Lee J', 'Gambardella L', 'Koehler KR', 'Teichmann SA', 'Haniffa M']","Gopee NH, et al. A prenatal skin atlas reveals immune regulation of human skin morphogenesis. A prenatal skin atlas reveals immune regulation of human skin morphogenesis. 2024; 635:679-689. doi: 10.1038/s41586-024-08002-x"
R21MD019360,40035674,10867700,AI-generated Podcast Summaries of Radiology Articles: Analysis of Content and Quality.,Radiology,2025,10.1148/radiol.243270,11950872,[],"['Tejani AS', 'Khosravi B', 'Savage CH', 'Moy L', 'Kahn CE', 'Yi PH']","Tejani AS, et al. AI-generated Podcast Summaries of Radiology Articles: Analysis of Content and Quality. AI-generated Podcast Summaries of Radiology Articles: Analysis of Content and Quality. 2025; 314:e243270. doi: 10.1148/radiol.243270"
R21MD019360,40105470,10867700,Bone Appetit: Skellytour Sets the Table for Robust Skeletal Segmentation.,Radiol Artif Intell,2025,10.1148/ryai.250057,11950880,[],"['Khosravi B', 'Rouzrokh P']",Khosravi B and Rouzrokh P. Bone Appetit: Skellytour Sets the Table for Robust Skeletal Segmentation. Bone Appetit: Skellytour Sets the Table for Robust Skeletal Segmentation. 2025; 7:e250057. doi: 10.1148/ryai.250057
R01EB034978,39963087,10878944,"Machine learning-based multi-pool Voigt fitting of CEST, rNOE, and MTC in Z-spectra.",Magn Reson Med,2025,10.1002/mrm.30460,12021569,[],"['Mohammed Ali S', 'van Zijl PCM', 'Prasuhn J', 'Wirestam R', 'Knutsson L', 'Yadav NN']","Mohammed Ali S, et al. Machine learning-based multi-pool Voigt fitting of CEST, rNOE, and MTC in Z-spectra. Machine learning-based multi-pool Voigt fitting of CEST, rNOE, and MTC in Z-spectra. 2025; 94:346-361. doi: 10.1002/mrm.30460"
R01EB034978,39532518,10878944,Motion and magnetic field inhomogeneity correction techniques for chemical exchange saturation transfer (CEST) MRI: A contemporary review.,NMR Biomed,2025,10.1002/nbm.5294,11606773,[],"['Simegn GL', 'Sun PZ', 'Zhou J', 'Kim M', 'Reddy R', 'Zu Z', 'Zaiss M', 'Yadav NN', 'Edden RAE', 'van Zijl PCM', 'Knutsson L']","Simegn GL, et al. Motion and magnetic field inhomogeneity correction techniques for chemical exchange saturation transfer (CEST) MRI: A contemporary review. Motion and magnetic field inhomogeneity correction techniques for chemical exchange saturation transfer (CEST) MRI: A contemporary review. 2025; 38:e5294. doi: 10.1002/nbm.5294"
R01EB034978,40096575,10878944,Dynamic glucose enhanced imaging using direct water saturation.,Magn Reson Med,2025,10.1002/mrm.30447,12021318,[],"['Knutsson L', 'Yadav NN', 'Mohammed Ali S', 'Kamson DO', 'Demetriou E', 'Seidemo A', 'Blair L', 'Lin DD', 'Laterra J', 'van Zijl PCM']","Knutsson L, et al. Dynamic glucose enhanced imaging using direct water saturation. Dynamic glucose enhanced imaging using direct water saturation. 2025; 94:15-27. doi: 10.1002/mrm.30447"
R01EB034978,39502884,10878944,Dynamic Glucose Enhanced Imaging using Direct Water Saturation.,ArXiv,2024,,11537340,[],"['Knutsson L', 'Yadav NN', 'Ali SM', 'Kamson DO', 'Demetriou E', 'Seidemo A', 'Blair L', 'Lin DD', 'Laterra J', 'VAN Zijl PCM']","Knutsson L, et al. Dynamic Glucose Enhanced Imaging using Direct Water Saturation. Dynamic Glucose Enhanced Imaging using Direct Water Saturation. 2024; (unknown volume):(unknown pages)."
R01NS102917,30736013,10883380,"Parallel, minimally-invasive implantation of ultra-flexible neural electrode arrays.",J Neural Eng,2019,10.1088/1741-2552/ab05b6,6506360,[],"['Zhao Z', 'Li X', 'He F', 'Wei X', 'Lin S', 'Xie C']","Zhao Z, et al. Parallel, minimally-invasive implantation of ultra-flexible neural electrode arrays. Parallel, minimally-invasive implantation of ultra-flexible neural electrode arrays. 2019; 16:035001. doi: 10.1088/1741-2552/ab05b6"
R01AI183314,39982066,11125744,Effects of human immunoglobulin A on Cryptococcus neoformans morphology and gene expression.,Microbiol Spectr,2025,10.1128/spectrum.02008-24,11960444,[],"['Trevijano-Contador N', 'de Oliveira HC', 'Malacatus-Bravo C', 'Sarai V', 'Cuesta I', 'Rodrigues ML', 'Zaragoza Ó', 'Pirofski L-a']","Trevijano-Contador N, et al. Effects of human immunoglobulin A on Cryptococcus neoformans morphology and gene expression. Effects of human immunoglobulin A on Cryptococcus neoformans morphology and gene expression. 2025; 13:e0200824. doi: 10.1128/spectrum.02008-24"
R01CA275015,38204657,10885188,Vascular invasion predicts the subgroup of lung adenocarcinomas ≤2.0 cm at risk of poor outcome treated by wedge resection compared to lobectomy.,JTCVS Open,2023,10.1016/j.xjon.2023.11.003,10775162,[],"['Ma L', 'Sullivan TB', 'Rieger-Christ KM', 'Yambayev I', 'Zhao Q', 'Higgins SE', 'Yilmaz OH', 'Sultan L', 'Servais EL', 'Suzuki K', 'Burks EJ']","Ma L, et al. Vascular invasion predicts the subgroup of lung adenocarcinomas ≤2.0 cm at risk of poor outcome treated by wedge resection compared to lobectomy. Vascular invasion predicts the subgroup of lung adenocarcinomas ≤2.0 cm at risk of poor outcome treated by wedge resection compared to lobectomy. 2023; 16:938-947. doi: 10.1016/j.xjon.2023.11.003"
R01CA284593,40045578,10890879,Clinical applications of oligonucleotides for cancer therapy.,Mol Ther,2025,10.1016/j.ymthe.2025.02.045,,[],"['DeFranciscis V', 'Amabile G', 'Kortylewski M']","DeFranciscis V, et al. Clinical applications of oligonucleotides for cancer therapy. Clinical applications of oligonucleotides for cancer therapy. 2025; (unknown volume):(unknown pages). doi: 10.1016/j.ymthe.2025.02.045"
R01CA283905,38904388,10891702,The Case for Neurosurgical Intervention in Cancer Neuroscience.,Neurosurgery,2025,10.1227/neu.0000000000003039,,[],"['Bernstock JD', 'Gerstl JVE', 'Chen JA', 'Johnston BR', 'Nonnenbroich LF', 'Spanehl L', 'Gessler FA', 'Valdes PA', 'Lu Y', 'Srinivasan SS', 'Smith TR', 'Peruzzi P', 'Rolston JD', 'Stone S', 'Chiocca EA']","Bernstock JD, et al. The Case for Neurosurgical Intervention in Cancer Neuroscience. The Case for Neurosurgical Intervention in Cancer Neuroscience. 2025; 96:10-17. doi: 10.1227/neu.0000000000003039"
R01NS105691,38915522,11055066,Parvalbumin interneuron activity induces slow cerebrovascular fluctuations in awake mice.,bioRxiv,2024,10.1101/2024.06.15.599179,11195210,[],"['Rakymzhan A', 'Fukuda M', 'Yoshida Kozai TD', 'Vazquez AL']","Rakymzhan A, et al. Parvalbumin interneuron activity induces slow cerebrovascular fluctuations in awake mice. Parvalbumin interneuron activity induces slow cerebrovascular fluctuations in awake mice. 2024; (unknown volume):(unknown pages). doi: 10.1101/2024.06.15.599179"
UC2MD019626,40136726,11167437,Unveiling the Molecular Crosstalk Between Periodontal and Cardiovascular Diseases: A Systematic Review.,Dent J (Basel),2025,10.3390/dj13030098,11941040,[],"['Dhungana G', 'Srisai D', 'Sampath C', 'Soliman J', 'Kelly RM', 'Saleh HY', 'Sedik A', 'Raynes E', 'Ferguson A', 'Alluri LSC', 'Gangula PR']","Dhungana G, et al. Unveiling the Molecular Crosstalk Between Periodontal and Cardiovascular Diseases: A Systematic Review. Unveiling the Molecular Crosstalk Between Periodontal and Cardiovascular Diseases: A Systematic Review. 2025; 13:(unknown pages). doi: 10.3390/dj13030098"
R01CA284268,38188703,10919803,Therapeutic Supramolecular Polymers: Designs and Applications.,Prog Polym Sci,2024,10.1016/j.progpolymsci.2023.101769,10769153,[],"['Wang H', 'Mills J', 'Sun B', 'Cui H']","Wang H, et al. Therapeutic Supramolecular Polymers: Designs and Applications. Therapeutic Supramolecular Polymers: Designs and Applications. 2024; 148:(unknown pages). doi: 10.1016/j.progpolymsci.2023.101769"
R34MH135768,40185966,10924360,HIV Risk Score and Prediction Model in the United States: A Scoping Review.,AIDS Behav,2025,10.1007/s10461-025-04702-1,,[],"['Albernas A', 'Patel MD', 'Cook RL', 'Vaddiparti K', 'Prosperi M', 'Liu Y']","Albernas A, et al. HIV Risk Score and Prediction Model in the United States: A Scoping Review. HIV Risk Score and Prediction Model in the United States: A Scoping Review. 2025; (unknown volume):(unknown pages). doi: 10.1007/s10461-025-04702-1"
R34MH135768,39950131,10924360,Predicting HIV Diagnosis Among Emerging Adults Using Electronic Health Records and Health Survey Data in All of Us Research Program.,Proceedings (IEEE Int Conf Bioinformatics Biomed),2024,10.1109/bibm62325.2024.10822296,11823436,[],"['Bhasuran B', 'Liu Y', 'Prosperi M', 'MacDonell K', 'Naar S', 'He Z']","Bhasuran B, et al. Predicting HIV Diagnosis Among Emerging Adults Using Electronic Health Records and Health Survey Data in All of Us Research Program. Predicting HIV Diagnosis Among Emerging Adults Using Electronic Health Records and Health Survey Data in All of Us Research Program. 2024; 2024:5433-5440. doi: 10.1109/bibm62325.2024.10822296"
R01CA276653,38948879,10928191,Receptor tyrosine kinase inhibition leads to regression of acral melanoma by targeting the tumor microenvironment.,bioRxiv,2024,10.1101/2024.06.15.599116,11212935,[],"['Smith EA', 'Belote RL', 'Cruz NM', 'Moustafa TE', 'Becker CA', 'Jiang A', 'Alizada S', 'Chan TY', 'Seasor TA', 'Balatico M', 'Cortes-Sanchez E', 'Lum DH', 'Hyngstrom JR', 'Zeng H', 'Deacon DC', 'Grossmann AH', 'White RM', 'Zangle TA', 'Judson-Torres RL']","Smith EA, et al. Receptor tyrosine kinase inhibition leads to regression of acral melanoma by targeting the tumor microenvironment. Receptor tyrosine kinase inhibition leads to regression of acral melanoma by targeting the tumor microenvironment. 2024; (unknown volume):(unknown pages). doi: 10.1101/2024.06.15.599116"
R01CA276653,39149239,10928191,Quadrant darkfield (QDF) for label-free imaging of intracellular puncta.,bioRxiv,2024,10.1101/2024.08.05.606686,11326191,[],"['Moustafa TE', 'Belote RL', 'Polanco ER', 'Judson-Torres RL', 'Zangle TA']","Moustafa TE, et al. Quadrant darkfield (QDF) for label-free imaging of intracellular puncta. Quadrant darkfield (QDF) for label-free imaging of intracellular puncta. 2024; (unknown volume):(unknown pages). doi: 10.1101/2024.08.05.606686"
R01CA276653,39618547,10928191,Quadrant darkfield for label-free imaging of intracellular puncta.,J Biomed Opt,2024,10.1117/1.JBO.29.11.116501,11605245,[],"['Moustafa TE', 'Belote RL', 'Polanco ER', 'Judson-Torres RL', 'Zangle TA']","Moustafa TE, et al. Quadrant darkfield for label-free imaging of intracellular puncta. Quadrant darkfield for label-free imaging of intracellular puncta. 2024; 29:116501. doi: 10.1117/1.JBO.29.11.116501"
R01CA293366,40128561,10945892,Real-time genomic characterization of pediatric acute leukemia using adaptive sampling.,Leukemia,2025,10.1038/s41375-025-02565-y,12055598,[],"['Geyer J', 'Opoku KB', 'Lin J', 'Ramkissoon L', 'Mullighan C', 'Bhakta N', 'Alexander TB', 'Wang JR']","Geyer J, et al. Real-time genomic characterization of pediatric acute leukemia using adaptive sampling. Real-time genomic characterization of pediatric acute leukemia using adaptive sampling. 2025; 39:1069-1077. doi: 10.1038/s41375-025-02565-y"
R21MD019768,39565627,10949665,"Cancer Mortality in Louisiana's Correctional System, 2015-2021.",JAMA Netw Open,2024,10.1001/jamanetworkopen.2024.46411,11579789,[],"['Dhimal T', 'Cupertino P', 'Cheng Z', 'Ramsdale EE', 'Hilty Chu BK', 'Kaplan BJ', 'Armstrong A', 'Cai X', 'Li Y', 'Fleming FJ', 'Loria A']","Dhimal T, et al. Cancer Mortality in Louisiana's Correctional System, 2015-2021. Cancer Mortality in Louisiana's Correctional System, 2015-2021. 2024; 7:e2446411. doi: 10.1001/jamanetworkopen.2024.46411"
R01DE033364,39840765,10980069,Osseointegration of 3D-Printable Polyetheretherketone-Magnesium Phosphate Bioactive Composites for Craniofacial and Orthopedic Implants.,ACS Biomater Sci Eng,2025,10.1021/acsbiomaterials.4c01597,11931609,[],"['Sonaye SY', 'Dal-Fabbro R', 'Bottino MC', 'Sikder P']","Sonaye SY, et al. Osseointegration of 3D-Printable Polyetheretherketone-Magnesium Phosphate Bioactive Composites for Craniofacial and Orthopedic Implants. Osseointegration of 3D-Printable Polyetheretherketone-Magnesium Phosphate Bioactive Composites for Craniofacial and Orthopedic Implants. 2025; 11:1060-1071. doi: 10.1021/acsbiomaterials.4c01597"
