coreproject,pmid,applid,title,journal,year,doi,pmc,grants,authors,citation
R01CA281682,37546917,10844584,Activation of the mevalonate pathway in response to anti-cancer treatments drives glioblastoma recurrences through activation of Rac-1.,bioRxiv,2023,10.1101/2023.07.23.550205,10402033,[],"['He L', 'Ioannidis A', 'Arambula E', 'Hoffman CJ', 'Joshi P', 'Kathiravan A', 'Whitelegge J', 'Liau LM', 'Kornblum HI', 'Pajonk F']","He L, et al. Activation of the mevalonate pathway in response to anti-cancer treatments drives glioblastoma recurrences through activation of Rac-1. Activation of the mevalonate pathway in response to anti-cancer treatments drives glioblastoma recurrences through activation of Rac-1. 2023; (unknown volume):(unknown pages). doi: 10.1101/2023.07.23.550205"
R01CA281682,37470216,10844584,Nicotinamide Adenine Dinucleotide Phosphate Oxidase Promotes Glioblastoma Radiation Resistance in a Phosphate and Tensin Homolog-Dependent Manner.,Antioxid Redox Signal,2023,10.1089/ars.2022.0086,10775910,[],"['Ludwig K', 'Le Belle JE', 'Muthukrishnan SD', 'Sperry J', 'Condro M', 'Vlashi E', 'Pajonk F', 'Kornblum HI']","Ludwig K, et al. Nicotinamide Adenine Dinucleotide Phosphate Oxidase Promotes Glioblastoma Radiation Resistance in a Phosphate and Tensin Homolog-Dependent Manner. Nicotinamide Adenine Dinucleotide Phosphate Oxidase Promotes Glioblastoma Radiation Resistance in a Phosphate and Tensin Homolog-Dependent Manner. 2023; 39:890-903. doi: 10.1089/ars.2022.0086"
R01CA281682,39341503,10844584,Effects of dopamine receptor antagonists and radiation on mouse neural stem/progenitor cells.,Radiother Oncol,2024,10.1016/j.radonc.2024.110562,11987595,[],"['He L', 'Bhat K', 'Ioannidis A', 'Pajonk F']","He L, et al. Effects of dopamine receptor antagonists and radiation on mouse neural stem/progenitor cells. Effects of dopamine receptor antagonists and radiation on mouse neural stem/progenitor cells. 2024; 201:110562. doi: 10.1016/j.radonc.2024.110562"
R01CA281682,38837899,10844584,Activation of the Mevalonate Pathway in Response to Anti-cancer Treatments Drives Glioblastoma Recurrences Through Activation of Rac-1.,Cancer Res Commun,2024,10.1158/2767-9764.CRC-24-0049,11197925,[],"['He L', 'Ioannidis A', 'Hoffman CJ', 'Arambula E', 'Joshi P', 'Whitelegge J', 'Liau LM', 'Kornblum HI', 'Pajonk F']","He L, et al. Activation of the Mevalonate Pathway in Response to Anti-cancer Treatments Drives Glioblastoma Recurrences Through Activation of Rac-1. Activation of the Mevalonate Pathway in Response to Anti-cancer Treatments Drives Glioblastoma Recurrences Through Activation of Rac-1. 2024; 4:1566-1580. doi: 10.1158/2767-9764.CRC-24-0049"
R01NS133965,38430211,11043419,Microphysiological Blood-Brain Barrier Systems for Disease Modeling and Drug Development.,Adv Healthc Mater,2024,10.1002/adhm.202303180,11338747,[],"['Mulay AR', 'Hwang J', 'Kim DH']","Mulay AR, et al. Microphysiological Blood-Brain Barrier Systems for Disease Modeling and Drug Development. Microphysiological Blood-Brain Barrier Systems for Disease Modeling and Drug Development. 2024; 13:e2303180. doi: 10.1002/adhm.202303180"
R01CA284593,39171140,10890879,Bi-functional CpG-STAT3 decoy oligonucleotide triggers multilineage differentiation of acute myeloid leukemia in mice.,Mol Ther Nucleic Acids,2024,10.1016/j.omtn.2024.102268,11338104,[],"['Wang D', 'Kaniowski D', 'Jacek K', 'Su YL', 'Yu C', 'Hall J', 'Li H', 'Feng M', 'Hui S', 'Kaminska B', 'DeFranciscis V', 'Esposito CL', 'DiRuscio A', 'Zhang B', 'Marcucci G', 'Kuo YH', 'Kortylewski M']","Wang D, et al. Bi-functional CpG-STAT3 decoy oligonucleotide triggers multilineage differentiation of acute myeloid leukemia in mice. Bi-functional CpG-STAT3 decoy oligonucleotide triggers multilineage differentiation of acute myeloid leukemia in mice. 2024; 35:102268. doi: 10.1016/j.omtn.2024.102268"
R01AI183332,39471811,11059866,Potent and broad HIV-1 neutralization in fusion peptide-primed SHIV-infected macaques.,Cell,2024,10.1016/j.cell.2024.10.003,11645223,[],"['Wang H', 'Cheng C', 'Dal Santo JL', 'Shen CH', 'Bylund T', 'Henry AR', 'Howe CA', 'Hwang J', 'Morano NC', 'Morris DJ', 'Pletnev S', 'Roark RS', 'Zhou T', 'Hansen BT', 'Hoyt FH', 'Johnston TS', 'Wang S', 'Zhang B', 'Ambrozak DR', 'Becker JE', 'Bender MF', 'Changela A', 'Chaudhary R', 'Corcoran M', 'Corrigan AR', 'Foulds KE', 'Guo Y', 'Lee M', 'Li Y', 'Lin BC', 'Liu T', 'Louder MK', 'Mandolesi M', 'Mason RD', 'McKee K', 'Nair V', ""O'Dell S"", 'Olia AS', 'Ou L', 'Pegu A', 'Raju N', 'Rawi R', 'Roberts-Torres J', 'Sarfo EK', 'Sastry M', 'Schaub AJ', 'Schmidt SD', 'Schramm CA', 'Schwartz CL', 'Smith SC', 'Stephens T', 'Stuckey J', 'Teng IT', 'Todd JP', 'Tsybovsky Y', 'Van Wazer DJ', 'Wang S', 'Doria-Rose NA', 'Fischer ER', 'Georgiev IS', 'Karlsson Hedestam GB', 'Sheng Z', 'Woodward RA', 'Douek DC', 'Koup RA', 'Pierson TC', 'Shapiro L', 'Shaw GM', 'Mascola JR', 'Kwong PD']","Wang H, et al. Potent and broad HIV-1 neutralization in fusion peptide-primed SHIV-infected macaques. Potent and broad HIV-1 neutralization in fusion peptide-primed SHIV-infected macaques. 2024; 187:7214-7231.e23. doi: 10.1016/j.cell.2024.10.003"
R01CA248323,35594991,11133363,Discovery Proteomics Analysis Determines That Driver Oncogenes Suppress Antiviral Defense Pathways Through Reduction in Interferon-β Autocrine Stimulation.,Mol Cell Proteomics,2022,10.1016/j.mcpro.2022.100247,9212846,[],"['Solomon PE', 'Kirkemo LL', 'Wilson GM', 'Leung KK', 'Almond MH', 'Sayles LC', 'Sweet-Cordero EA', 'Rosenberg OS', 'Coon JJ', 'Wells JA']","Solomon PE, et al. Discovery Proteomics Analysis Determines That Driver Oncogenes Suppress Antiviral Defense Pathways Through Reduction in Interferon-β Autocrine Stimulation. Discovery Proteomics Analysis Determines That Driver Oncogenes Suppress Antiviral Defense Pathways Through Reduction in Interferon-β Autocrine Stimulation. 2022; 21:100247. doi: 10.1016/j.mcpro.2022.100247"
R01CA248323,36138170,11133363,Modular cytokine receptor-targeting chimeras for targeted degradation of cell surface and extracellular proteins.,Nat Biotechnol,2023,10.1038/s41587-022-01456-2,9931583,[],"['Pance K', 'Gramespacher JA', 'Byrnes JR', 'Salangsang F', 'Serrano JC', 'Cotton AD', 'Steri V', 'Wells JA']","Pance K, et al. Modular cytokine receptor-targeting chimeras for targeted degradation of cell surface and extracellular proteins. Modular cytokine receptor-targeting chimeras for targeted degradation of cell surface and extracellular proteins. 2023; 41:273-281. doi: 10.1038/s41587-022-01456-2"
R01NS128461,37896238,10881982,Focused Ultrasound-Mediated Delivery of Anti-Programmed Cell Death-Ligand 1 Antibody to the Brain of a Porcine Model.,Pharmaceutics,2023,10.3390/pharmaceutics15102479,10610297,[],"['Fadera S', 'Chukwu C', 'Stark AH', 'Yue Y', 'Xu L', 'Chien CY', 'Yuan J', 'Chen H']","Fadera S, et al. Focused Ultrasound-Mediated Delivery of Anti-Programmed Cell Death-Ligand 1 Antibody to the Brain of a Porcine Model. Focused Ultrasound-Mediated Delivery of Anti-Programmed Cell Death-Ligand 1 Antibody to the Brain of a Porcine Model. 2023; 15:(unknown pages). doi: 10.3390/pharmaceutics15102479"
R01NS128461,36993173,10881982,First-in-human prospective trial of sonobiopsy in glioblastoma patients using neuronavigation-guided focused ultrasound.,medRxiv,2023,10.1101/2023.03.17.23287378,10055591,[],"['Yuan J', 'Xu L', 'Chien CY', 'Yang Y', 'Yue Y', 'Fadera S', 'Stark AH', 'Schwetye KE', 'Nazeri A', 'Desai R', 'Athiraman U', 'Chaudhuri AA', 'Chen H', 'Leuthardt EC']","Yuan J, et al. First-in-human prospective trial of sonobiopsy in glioblastoma patients using neuronavigation-guided focused ultrasound. First-in-human prospective trial of sonobiopsy in glioblastoma patients using neuronavigation-guided focused ultrasound. 2023; (unknown volume):(unknown pages). doi: 10.1101/2023.03.17.23287378"
R01NS128461,37598243,10881982,Transcranial focused ultrasound-induced blood‒brain barrier opening in mice without shaving hairs.,Sci Rep,2023,10.1038/s41598-023-40598-4,10439893,[],"['Xu L', 'Gong Y', 'Chien CY', 'Leuthardt E', 'Chen H']","Xu L, et al. Transcranial focused ultrasound-induced blood‒brain barrier opening in mice without shaving hairs. Transcranial focused ultrasound-induced blood‒brain barrier opening in mice without shaving hairs. 2023; 13:13500. doi: 10.1038/s41598-023-40598-4"
R01NS128461,38906479,10881982,Adeno-associated virus vector delivery to the brain: Technology advancements and clinical applications.,Adv Drug Deliv Rev,2024,10.1016/j.addr.2024.115363,11892011,[],"['Ye D', 'Chukwu C', 'Yang Y', 'Hu Z', 'Chen H']","Ye D, et al. Adeno-associated virus vector delivery to the brain: Technology advancements and clinical applications. Adeno-associated virus vector delivery to the brain: Technology advancements and clinical applications. 2024; 211:115363. doi: 10.1016/j.addr.2024.115363"
R01NS128461,37717084,10881982,First-in-human prospective trial of sonobiopsy in high-grade glioma patients using neuronavigation-guided focused ultrasound.,NPJ Precis Oncol,2023,10.1038/s41698-023-00448-y,10505140,[],"['Yuan J', 'Xu L', 'Chien CY', 'Yang Y', 'Yue Y', 'Fadera S', 'Stark AH', 'Schwetye KE', 'Nazeri A', 'Desai R', 'Athiraman U', 'Chaudhuri AA', 'Chen H', 'Leuthardt EC']","Yuan J, et al. First-in-human prospective trial of sonobiopsy in high-grade glioma patients using neuronavigation-guided focused ultrasound. First-in-human prospective trial of sonobiopsy in high-grade glioma patients using neuronavigation-guided focused ultrasound. 2023; 7:92. doi: 10.1038/s41698-023-00448-y"
R01NS128461,38531173,10881982,Quality assurance for focused ultrasound-induced blood-brain barrier opening procedure using passive acoustic detection.,EBioMedicine,2024,10.1016/j.ebiom.2024.105066,10987799,[],"['Chien CY', 'Xu L', 'Yuan J', 'Fadera S', 'Stark AH', 'Athiraman U', 'Leuthardt EC', 'Chen H']","Chien CY, et al. Quality assurance for focused ultrasound-induced blood-brain barrier opening procedure using passive acoustic detection. Quality assurance for focused ultrasound-induced blood-brain barrier opening procedure using passive acoustic detection. 2024; 102:105066. doi: 10.1016/j.ebiom.2024.105066"
R01EY028666,32097748,10802911,Multifunctional synthetic Bowman's membrane-stromal biomimetic for corneal reconstruction.,Biomaterials,2020,10.1016/j.biomaterials.2020.119880,7236884,[],"['Wang X', 'Majumdar S', 'Soiberman U', 'Webb JN', 'Chung L', 'Scarcelli G', 'Elisseeff JH']","Wang X, et al. Multifunctional synthetic Bowman's membrane-stromal biomimetic for corneal reconstruction. Multifunctional synthetic Bowman's membrane-stromal biomimetic for corneal reconstruction. 2020; 241:119880. doi: 10.1016/j.biomaterials.2020.119880"
R01ES030380,37682723,10980804,Invited Perspective: Making the Implicit Explicit-Connecting Environmental Health Literacy and Exposure Report-Back.,Environ Health Perspect,2023,10.1289/EHP13493,10489875,[],['Hoover AG'],Hoover AG. Invited Perspective: Making the Implicit Explicit-Connecting Environmental Health Literacy and Exposure Report-Back. Invited Perspective: Making the Implicit Explicit-Connecting Environmental Health Literacy and Exposure Report-Back. 2023; 131:91301. doi: 10.1289/EHP13493
R01AI186809,39230306,11009423,Three families of CD4-induced antibodies are associated with the capacity of plasma from people living with HIV to mediate ADCC in the presence of CD4-mimetics.,J Virol,2024,10.1128/jvi.00960-24,11495032,[],"['Tauzin A', 'Marchitto L', 'Bélanger É', 'Benlarbi M', 'Beaudoin-Bussières G', 'Prévost J', 'Yang D', 'Chiu T-J', 'Chen H-C', 'Bourassa C', 'Medjahed H', 'Korzeniowski MK', 'Gottumukkala S', 'Tolbert WD', 'Richard J', 'Smith AB', 'Pazgier M', 'Finzi A']","Tauzin A, et al. Three families of CD4-induced antibodies are associated with the capacity of plasma from people living with HIV to mediate ADCC in the presence of CD4-mimetics. Three families of CD4-induced antibodies are associated with the capacity of plasma from people living with HIV to mediate ADCC in the presence of CD4-mimetics. 2024; 98:e0096024. doi: 10.1128/jvi.00960-24"
R01CA284593,38384444,10890879,Oligo-PROTAC strategy for cell-selective and targeted degradation of activated STAT3.,Mol Ther Nucleic Acids,2024,10.1016/j.omtn.2024.102137,10879796,[],"['Hall J', 'Zhang Z', 'Bhattacharya S', 'Wang D', 'Alcantara M', 'Liang Y', 'Swiderski P', 'Forman S', 'Kwak L', 'Vaidehi N', 'Kortylewski M']","Hall J, et al. Oligo-PROTAC strategy for cell-selective and targeted degradation of activated STAT3. Oligo-PROTAC strategy for cell-selective and targeted degradation of activated STAT3. 2024; 35:102137. doi: 10.1016/j.omtn.2024.102137"
R01CA282781,39120312,10846712,Therapy-Induced Cellular Senescence: Potentiating Tumor Elimination or Driving Cancer Resistance and Recurrence?,Cells,2024,10.3390/cells13151281,11312217,[],"['Liu Y', 'Lomeli I', 'Kron SJ']","Liu Y, et al. Therapy-Induced Cellular Senescence: Potentiating Tumor Elimination or Driving Cancer Resistance and Recurrence?. Therapy-Induced Cellular Senescence: Potentiating Tumor Elimination or Driving Cancer Resistance and Recurrence?. 2024; 13:(unknown pages). doi: 10.3390/cells13151281"
R01EY028666,39606723,10802911,Consensus Statement on Brillouin Light Scattering Microscopy of Biological Materials.,ArXiv,2024,,11601801,[],"['Bouvet P', 'Bevilacqua C', 'Ambekar Y', 'Antonacci G', 'Au J', 'Caponi S', 'Chagnon-Lessard S', 'Czarske J', 'Dehoux T', 'Fioretto D', 'Fu Y', 'Guck J', 'Hamann T', 'Heinemann D', 'Jähnke T', 'Jean-Ruel H', 'Kabakova I', 'Koski K', 'Koukourakis N', 'Krause D', 'La Cavera S', 'Landes T', 'Li J', 'Margueritat J', 'Mattarelli M', 'Monaghan M', 'Overby DR', 'Perez-Cota F', 'Pontecorvo E', 'Prevedel R', 'Ruocco G', 'Sandercock J', 'Scarcelli G', 'Scarponi F', 'Testi C', 'Török P', 'Vovard L', 'Weninger W', 'Yakovlev V', 'Yun SH', 'Zhang J', 'Palombo F', 'Bilenca A', 'Elsayad K']","Bouvet P, et al. Consensus Statement on Brillouin Light Scattering Microscopy of Biological Materials. Consensus Statement on Brillouin Light Scattering Microscopy of Biological Materials. 2024; (unknown volume):(unknown pages)."
R01CA276525,38617078,11062923,"An inexpensive ""do-it-yourself"" device for rapid generation of uniform tumor spheroids.",Device,2024,10.1016/j.device.2024.100255,11008532,[],"['Namgung B', 'Dai H', 'Prathyushaa Vikraman P', 'Saha T', 'Sengupta S', 'Lin Jang H']","Namgung B, et al. An inexpensive ""do-it-yourself"" device for rapid generation of uniform tumor spheroids. An inexpensive ""do-it-yourself"" device for rapid generation of uniform tumor spheroids. 2024; 2:(unknown pages). doi: 10.1016/j.device.2024.100255"
R01DE032406,38617078,11077887,"An inexpensive ""do-it-yourself"" device for rapid generation of uniform tumor spheroids.",Device,2024,10.1016/j.device.2024.100255,11008532,[],"['Namgung B', 'Dai H', 'Prathyushaa Vikraman P', 'Saha T', 'Sengupta S', 'Lin Jang H']","Namgung B, et al. An inexpensive ""do-it-yourself"" device for rapid generation of uniform tumor spheroids. An inexpensive ""do-it-yourself"" device for rapid generation of uniform tumor spheroids. 2024; 2:(unknown pages). doi: 10.1016/j.device.2024.100255"
R01NS102917,33120025,10883380,"Recent Advances in Electrical Neural Interface Engineering: Minimal Invasiveness, Longevity, and Scalability.",Neuron,2020,10.1016/j.neuron.2020.10.011,7646678,[],"['Luan L', 'Robinson JT', 'Aazhang B', 'Chi T', 'Yang K', 'Li X', 'Rathore H', 'Singer A', 'Yellapantula S', 'Fan Y', 'Yu Z', 'Xie C']","Luan L, et al. Recent Advances in Electrical Neural Interface Engineering: Minimal Invasiveness, Longevity, and Scalability. Recent Advances in Electrical Neural Interface Engineering: Minimal Invasiveness, Longevity, and Scalability. 2020; 108:302-321. doi: 10.1016/j.neuron.2020.10.011"
R01NS136622,39078097,11077761,Improving Sensitivity and Longevity of In Vivo Glutamate Sensors with Electrodeposited NanoPt.,ACS Appl Mater Interfaces,2024,10.1021/acsami.4c06692,11310907,[],"['Robbins EM', 'Wong B', 'Pwint MY', 'Salavatian S', 'Mahajan A', 'Cui XT']","Robbins EM, et al. Improving Sensitivity and Longevity of In Vivo Glutamate Sensors with Electrodeposited NanoPt. Improving Sensitivity and Longevity of In Vivo Glutamate Sensors with Electrodeposited NanoPt. 2024; 16:40570-40580. doi: 10.1021/acsami.4c06692"
R01NS102917,38728138,10883380,Ultraflexible electrodes for recording neural activity in the mouse spinal cord during motor behavior.,Cell Rep,2024,10.1016/j.celrep.2024.114199,11233142,[],"['Wu Y', 'Temple BA', 'Sevilla N', 'Zhang J', 'Zhu H', 'Zolotavin P', 'Jin Y', 'Duarte D', 'Sanders E', 'Azim E', 'Nimmerjahn A', 'Pfaff SL', 'Luan L', 'Xie C']","Wu Y, et al. Ultraflexible electrodes for recording neural activity in the mouse spinal cord during motor behavior. Ultraflexible electrodes for recording neural activity in the mouse spinal cord during motor behavior. 2024; 43:114199. doi: 10.1016/j.celrep.2024.114199"
R01NS102917,34284369,10883380,Multi-scale neural decoding and analysis.,J Neural Eng,2021,10.1088/1741-2552/ac160f,8840800,[],"['Lu HY', 'Lorenc ES', 'Zhu H', 'Kilmarx J', 'Sulzer J', 'Xie C', 'Tobler PN', 'Watrous AJ', 'Orsborn AL', 'Lewis-Peacock J', 'Santacruz SR']","Lu HY, et al. Multi-scale neural decoding and analysis. Multi-scale neural decoding and analysis. 2021; 18:(unknown pages). doi: 10.1088/1741-2552/ac160f"
R01NS102917,36403326,10883380,Longitudinal neural and vascular recovery following ultraflexible neural electrode implantation in aged mice.,Biomaterials,2022,10.1016/j.biomaterials.2022.121905,9701172,[],"['He F', 'Sun Y', 'Jin Y', 'Yin R', 'Zhu H', 'Rathore H', 'Xie C', 'Luan L']","He F, et al. Longitudinal neural and vascular recovery following ultraflexible neural electrode implantation in aged mice. Longitudinal neural and vascular recovery following ultraflexible neural electrode implantation in aged mice. 2022; 291:121905. doi: 10.1016/j.biomaterials.2022.121905"
R01NS102917,35036472,10883380,Chronic co-implantation of ultraflexible neural electrodes and a cranial window.,Neurophotonics,2022,10.1117/1.NPh.9.3.032204,8756486,[],"['Yin R', 'Noble BC', 'He F', 'Zolotavin P', 'Rathore H', 'Jin Y', 'Sevilla N', 'Xie C', 'Luan L']","Yin R, et al. Chronic co-implantation of ultraflexible neural electrodes and a cranial window. Chronic co-implantation of ultraflexible neural electrodes and a cranial window. 2022; 9:032204. doi: 10.1117/1.NPh.9.3.032204"
R01NS102917,37235473,10883380,"Low-threshold, high-resolution, chronically stable intracortical microstimulation by ultraflexible electrodes.",Cell Rep,2023,10.1016/j.celrep.2023.112554,10592461,[],"['Lycke R', 'Kim R', 'Zolotavin P', 'Montes J', 'Sun Y', 'Koszeghy A', 'Altun E', 'Noble B', 'Yin R', 'He F', 'Totah N', 'Xie C', 'Luan L']","Lycke R, et al. Low-threshold, high-resolution, chronically stable intracortical microstimulation by ultraflexible electrodes. Low-threshold, high-resolution, chronically stable intracortical microstimulation by ultraflexible electrodes. 2023; 42:112554. doi: 10.1016/j.celrep.2023.112554"
R01NS102917,37289556,10883380,Emerging Penetrating Neural Electrodes: In Pursuit of Large Scale and Longevity.,Annu Rev Biomed Eng,2023,10.1146/annurev-bioeng-090622-050507,11078330,[],"['Luan L', 'Yin R', 'Zhu H', 'Xie C']","Luan L, et al. Emerging Penetrating Neural Electrodes: In Pursuit of Large Scale and Longevity. Emerging Penetrating Neural Electrodes: In Pursuit of Large Scale and Longevity. 2023; 25:185-205. doi: 10.1146/annurev-bioeng-090622-050507"
R01CA248323,35481357,11133363,Roadmap for Optimizing and Broadening Antibody-Based PROTACs for Degradation of Cell Surface Proteins.,ACS Chem Biol,2022,10.1021/acschembio.2c00185,,[],"['Gramespacher JA', 'Cotton AD', 'Burroughs PWW', 'Seiple IB', 'Wells JA']","Gramespacher JA, et al. Roadmap for Optimizing and Broadening Antibody-Based PROTACs for Degradation of Cell Surface Proteins. Roadmap for Optimizing and Broadening Antibody-Based PROTACs for Degradation of Cell Surface Proteins. 2022; 17:1259-1268. doi: 10.1021/acschembio.2c00185"
R01CA248323,38099269,11133363,Secreted HLA-Fc fusion profiles immunopeptidome in hypoxic PDAC and cellular senescence.,PNAS Nexus,2023,10.1093/pnasnexus/pgad400,10720946,[],"['Rettko NJ', 'Kirkemo LL', 'Wells JA']","Rettko NJ, et al. Secreted HLA-Fc fusion profiles immunopeptidome in hypoxic PDAC and cellular senescence. Secreted HLA-Fc fusion profiles immunopeptidome in hypoxic PDAC and cellular senescence. 2023; 2:pgad400. doi: 10.1093/pnasnexus/pgad400"
R01CA248323,35257663,11133363,Cell-surface tethered promiscuous biotinylators enable comparative small-scale surface proteomic analysis of human extracellular vesicles and cells.,Elife,2022,10.7554/eLife.73982,8983049,[],"['Kirkemo LL', 'Elledge SK', 'Yang J', 'Byrnes JR', 'Glasgow JE', 'Blelloch R', 'Wells JA']","Kirkemo LL, et al. Cell-surface tethered promiscuous biotinylators enable comparative small-scale surface proteomic analysis of human extracellular vesicles and cells. Cell-surface tethered promiscuous biotinylators enable comparative small-scale surface proteomic analysis of human extracellular vesicles and cells. 2022; 11:(unknown pages). doi: 10.7554/eLife.73982"
R01NS102917,32353330,10883380,Spikes to Pixels: Camera Chips for Large-scale Electrophysiology.,Trends Neurosci,2020,10.1016/j.tins.2020.03.001,,[],"['Lycke R', 'Sun L', 'Luan L', 'Xie C']","Lycke R, et al. Spikes to Pixels: Camera Chips for Large-scale Electrophysiology. Spikes to Pixels: Camera Chips for Large-scale Electrophysiology. 2020; 43:269-271. doi: 10.1016/j.tins.2020.03.001"
R01EY029023,33170283,11050128,A Coincident Thinning Index for Keratoconus Identification Using OCT Pachymetry and Epithelial Thickness Maps.,J Refract Surg,2020,10.3928/1081597X-20200925-01,8629024,[],"['Pavlatos E', 'Chen S', 'Yang Y', 'Wang Q', 'Huang D', 'Li Y']","Pavlatos E, et al. A Coincident Thinning Index for Keratoconus Identification Using OCT Pachymetry and Epithelial Thickness Maps. A Coincident Thinning Index for Keratoconus Identification Using OCT Pachymetry and Epithelial Thickness Maps. 2020; 36:757-765. doi: 10.3928/1081597X-20200925-01"
R01EY029023,35616503,11050128,Measuring corneal astigmatism using OCT in keratoconus.,J Cataract Refract Surg,2022,10.1097/j.jcrs.0000000000000977,10414777,[],"['Llorens-Quintana C', 'Lee DJ', 'Pavlatos E', 'Chamberlain W', 'Huang D', 'Li Y']","Llorens-Quintana C, et al. Measuring corneal astigmatism using OCT in keratoconus. Measuring corneal astigmatism using OCT in keratoconus. 2022; 48:1285-1291. doi: 10.1097/j.jcrs.0000000000000977"
R01EY029023,37827941,11050128,Characterization of the external limbus on corneoscleral topography with ultrawide-field optical coherence tomography.,Cont Lens Anterior Eye,2023,10.1016/j.clae.2023.102065,10842492,[],"['Llorens-Quintana C', 'Li Y', 'Chen S', 'Fujimoto JG', 'Huang D']","Llorens-Quintana C, et al. Characterization of the external limbus on corneoscleral topography with ultrawide-field optical coherence tomography. Characterization of the external limbus on corneoscleral topography with ultrawide-field optical coherence tomography. 2023; 46:102065. doi: 10.1016/j.clae.2023.102065"
R01EY029023,33409001,11050128,Eye motion correction algorithm for OCT-based corneal topography.,Biomed Opt Express,2020,10.1364/BOE.412209,7747916,[],"['Pavlatos E', 'Huang D', 'Li Y']","Pavlatos E, et al. Eye motion correction algorithm for OCT-based corneal topography. Eye motion correction algorithm for OCT-based corneal topography. 2020; 11:7343-7356. doi: 10.1364/BOE.412209"
R01EY029023,33181629,11050128,Keratoconus detection using OCT corneal and epithelial thickness map parameters and patterns.,J Cataract Refract Surg,2021,10.1097/j.jcrs.0000000000000498,8131403,[],"['Yang Y', 'Pavlatos E', 'Chamberlain W', 'Huang D', 'Li Y']","Yang Y, et al. Keratoconus detection using OCT corneal and epithelial thickness map parameters and patterns. Keratoconus detection using OCT corneal and epithelial thickness map parameters and patterns. 2021; 47:759-766. doi: 10.1097/j.jcrs.0000000000000498"
R01EY029023,34326282,11050128,Accuracy of OCT-derived net corneal astigmatism measurement.,J Cataract Refract Surg,2022,10.1097/j.jcrs.0000000000000766,8792105,[],"['Llorens-Quintana C', 'Pavlatos E', 'Thaware O', 'Gupta S', 'Gradin D', 'Romfh D', 'Li Y', 'Huang D']","Llorens-Quintana C, et al. Accuracy of OCT-derived net corneal astigmatism measurement. Accuracy of OCT-derived net corneal astigmatism measurement. 2022; 48:267-274. doi: 10.1097/j.jcrs.0000000000000766"
R01EY029023,35946999,11050128,Detection of Corneal Ectasia Using OCT Maps of Pachymetry and Posterior Surface Mean Curvature.,J Refract Surg,2022,10.3928/1081597X-20220711-01,10311947,[],"['Pavlatos E', 'Chen S', 'Chamberlain W', 'Huang D', 'Li Y']","Pavlatos E, et al. Detection of Corneal Ectasia Using OCT Maps of Pachymetry and Posterior Surface Mean Curvature. Detection of Corneal Ectasia Using OCT Maps of Pachymetry and Posterior Surface Mean Curvature. 2022; 38:502-510. doi: 10.3928/1081597X-20220711-01"
R01EY029023,35156455,11050128,Differentiating Between Contact Lens Warpage and Keratoconus Using OCT Maps of Corneal Mean Curvature and Epithelial Thickness.,J Refract Surg,2022,10.3928/1081597X-20211116-01,8870421,[],"['Pavlatos E', 'Harkness B', 'Louie D', 'Chamberlain W', 'Huang D', 'Li Y']","Pavlatos E, et al. Differentiating Between Contact Lens Warpage and Keratoconus Using OCT Maps of Corneal Mean Curvature and Epithelial Thickness. Differentiating Between Contact Lens Warpage and Keratoconus Using OCT Maps of Corneal Mean Curvature and Epithelial Thickness. 2022; 38:112-119. doi: 10.3928/1081597X-20211116-01"
